{
    "schema": "lpy",
    "scalars": {
        "leafduration": {
            "type": "Integer",
            "value": 8,
            "min": 1,
            "max": 10,
            "step": 1
        },
        "leafold": {
            "type": "Integer",
            "value": 3,
            "min": 1,
            "max": 10,
            "step": 1
        },
        "maxorder": {
            "type": "Integer",
            "value": 6,
            "min": 1,
            "max": 10,
            "step": 1
        },
        "radinc": {
            "type": "Float",
            "value": 0.04,
            "min": 0.01,
            "max": 0.1,
            "step": 0.01
        }
    },
    "materials": {
        "color_1": {
            "index": 1,
            "ambient": [
                96,
                77,
                62
            ],
            "diffuse": 0.0,
            "specular": [
                71,
                143,
                159
            ],
            "emission": [
                31,
                72,
                219
            ],
            "transparency": 0.0,
            "shininess": 0.7
        },
        "color_2": {
            "index": 2,
            "ambient": [
                194,
                81,
                115
            ],
            "diffuse": 1.0,
            "specular": [
                71,
                143,
                159
            ],
            "emission": [
                31,
                72,
                219
            ],
            "transparency": 1.0
        },
        "color_4": {
            "index": 4,
            "ambient": [
                225,
                160,
                20
            ],
            "diffuse": 1.0,
            "specular": [
                71,
                143,
                159
            ],
            "emission": [
                31,
                72,
                219
            ],
            "transparency": 1.0
        }
    },
    "functions": {},
    "curves": {
        "BezierCurve2D_0": {
            "BezierCurve2D": [
                [
                    -0.5,
                    0
                ],
                [
                    -0.25,
                    0.25
                ],
                [
                    0.25,
                    -0.25
                ],
                [
                    0.5,
                    0
                ]
            ]
        }
    }
}